{
  "$schema": "../schemas/theme-v1.schema.json",
  "schemaVersion": 1,
  "version": "1.0.0",
  "displayName": "Glacier Glass",
  "codeThemeId": "glacier-glass",
  "category": "风景",
  "description": "冰川蓝、玻璃白与极光青构成的清透主题，适合审查、整理与高密度信息阅读。",
  "author": "Codex Skin",
  "variant": "light",
  "previewImage": "../previews/glacier-glass.png",
  "theme": {
    "accent": "#168fb2",
    "contrast": 54,
    "fonts": {
      "code": "JetBrainsMono NFM",
      "ui": "\"Microsoft YaHei UI\", \"PingFang SC\", \"Noto Sans SC\", \"Segoe UI\", sans-serif",
      "display": "\"Microsoft YaHei UI\", \"PingFang SC\", \"Noto Sans SC\", \"Segoe UI\", sans-serif"
    },
    "ink": "#173746",
    "opaqueWindows": false,
    "semanticColors": {
      "diffAdded": "#38b980",
      "diffRemoved": "#ef6472",
      "skill": "#5c69d8"
    },
    "surface": "#eaf7fa",
    "backgroundImage": "../backgrounds/glacier-glass.png",
    "backgroundPosition": "center",
    "visualIntensity": "balanced",
    "backgroundImageOpacity": 0.72,
    "backgroundImageBlur": 0
  },
  "home": {
    "brand": "冰川玻璃",
    "eyebrow": "Glacier Glass",
    "badge": "CLEAR VIEW",
    "title": "看清结构，也看见细小裂纹",
    "subtitle": "以冷静视角审查系统，让改动清澈可靠",
    "tags": [
      "理解",
      "构建",
      "审查",
      "修复"
    ],
    "sidebarLabels": {
      "newTask": "新建任务",
      "scheduled": "任务排期",
      "plugins": "插件",
      "settings": "设置"
    },
    "composerHint": "描述你的目标，我们从最清楚的一步开始…",
    "footerNote": "Glacier Glass · Codex Skin Original",
    "quickActions": [
      {
        "icon": "⌁",
        "title": "理解代码",
        "description": "梳理结构与关键路径",
        "prompt": "请探索当前代码库，概览结构、关键模块与主要数据流。"
      },
      {
        "icon": "+",
        "title": "构建功能",
        "description": "把目标变成可靠实现",
        "prompt": "请根据当前项目构建这个功能，并验证核心体验。"
      },
      {
        "icon": "✓",
        "title": "审查改动",
        "description": "发现风险与遗漏",
        "prompt": "请审查当前改动，优先寻找缺陷、回归风险和缺失测试。"
      },
      {
        "icon": "!",
        "title": "修复问题",
        "description": "定位根因并完成验证",
        "prompt": "请诊断当前问题，找到根因、完成修复并验证结果。"
      }
    ]
  },
  "copy": {
    "title": "Codex · 冰川玻璃",
    "replacePlaceholders": {
      "Ask Codex": "Describe the next step...",
      "Ask Codex anything": "描述你的目标，我们从最清楚的一步开始…",
      "向 Codex 询问任何问题": "描述你的目标，我们从最清楚的一步开始…",
      "给 Codex 发送消息": "描述你的目标，我们从最清楚的一步开始…"
    }
  }
}
