{
  "$schema": "../schemas/theme-v1.schema.json",
  "schemaVersion": 1,
  "version": "1.0.0",
  "displayName": "Desert Signal",
  "codeThemeId": "desert-signal",
  "category": "风景",
  "description": "沙丘金、陶土橙与绿洲青组成的暖色主题，适合规划路线和持续推进长任务。",
  "author": "Codex Skin",
  "variant": "light",
  "previewImage": "../previews/desert-signal.png",
  "theme": {
    "accent": "#d86f3d",
    "contrast": 54,
    "fonts": {
      "code": "JetBrainsMono NFM",
      "ui": "\"Microsoft YaHei UI\", \"PingFang SC\", \"Noto Sans SC\", \"Segoe UI\", sans-serif",
      "display": "\"Microsoft YaHei UI\", \"PingFang SC\", \"Noto Sans SC\", \"Segoe UI\", sans-serif"
    },
    "ink": "#3d3028",
    "opaqueWindows": false,
    "semanticColors": {
      "diffAdded": "#38b980",
      "diffRemoved": "#ef6472",
      "skill": "#147f78"
    },
    "surface": "#f3dfbd",
    "backgroundImage": "../backgrounds/desert-signal.png",
    "backgroundPosition": "center",
    "visualIntensity": "balanced",
    "backgroundImageOpacity": 0.72,
    "backgroundImageBlur": 0
  },
  "home": {
    "brand": "沙漠信号",
    "eyebrow": "Desert Signal",
    "badge": "LONG RUN",
    "title": "沿着信号，把远方变成路线",
    "subtitle": "确认方向、保存体力，然后稳定抵达",
    "tags": [
      "理解",
      "构建",
      "审查",
      "修复"
    ],
    "sidebarLabels": {
      "newTask": "新建任务",
      "scheduled": "任务排期",
      "plugins": "插件",
      "settings": "设置"
    },
    "composerHint": "描述你的目标，我们从最清楚的一步开始…",
    "footerNote": "Desert Signal · Codex Skin Original",
    "quickActions": [
      {
        "icon": "⌁",
        "title": "理解代码",
        "description": "梳理结构与关键路径",
        "prompt": "请探索当前代码库，概览结构、关键模块与主要数据流。"
      },
      {
        "icon": "+",
        "title": "构建功能",
        "description": "把目标变成可靠实现",
        "prompt": "请根据当前项目构建这个功能，并验证核心体验。"
      },
      {
        "icon": "✓",
        "title": "审查改动",
        "description": "发现风险与遗漏",
        "prompt": "请审查当前改动，优先寻找缺陷、回归风险和缺失测试。"
      },
      {
        "icon": "!",
        "title": "修复问题",
        "description": "定位根因并完成验证",
        "prompt": "请诊断当前问题，找到根因、完成修复并验证结果。"
      }
    ]
  },
  "copy": {
    "title": "Codex · 沙漠信号",
    "replacePlaceholders": {
      "Ask Codex": "Describe the next step...",
      "Ask Codex anything": "描述你的目标，我们从最清楚的一步开始…",
      "向 Codex 询问任何问题": "描述你的目标，我们从最清楚的一步开始…",
      "给 Codex 发送消息": "描述你的目标，我们从最清楚的一步开始…"
    }
  }
}
