{
  "$schema": "../schemas/theme-v1.schema.json",
  "schemaVersion": 1,
  "version": "1.0.0",
  "displayName": "Dilraba Star",
  "codeThemeId": "dilraba-star",
  "category": "人物",
  "description": "星光蓝紫与甜酷舞台氛围",
  "author": "Codex Skin",
  "variant": "light",
  "previewImage": "../previews/dilraba-star.png",
  "theme": {
    "accent": "#7b49ff",
    "contrast": 52,
    "fonts": {
      "code": "JetBrainsMono NFM",
      "ui": "\"Microsoft YaHei UI\", \"PingFang SC\", \"Noto Sans SC\", \"Segoe UI\", sans-serif",
      "display": "\"Noto Serif SC\", \"Source Han Serif SC\", STSong, SimSun, Georgia, serif"
    },
    "ink": "#151b72",
    "opaqueWindows": true,
    "semanticColors": {
      "diffAdded": "#2be7c8",
      "diffRemoved": "#ff5f8f",
      "skill": "#b459ff"
    },
    "surface": "#f4f1ff",
    "backgroundImage": "../backgrounds/dilraba-star-hero-v3.jpg",
    "backgroundPosition": "center top",
    "logoImage": "../logos/dilraba-star-logo-ui-v1.png",
    "backgroundImageOpacity": 1,
    "backgroundImageBlur": 0
  },
  "home": {
    "brand": "Dilraba",
    "eyebrow": "迪丽热巴专属定制皮肤",
    "badge": "NO.",
    "title": "我们该构建什么？",
    "subtitle": "与热巴一起，用灵感创造无限可能",
    "tags": [
      "星光灵感",
      "甜酷创作",
      "热巴同频",
      "高光时刻"
    ],
    "sidebarLabels": {
      "newTask": "新建灵感",
      "scheduled": "已安排",
      "plugins": "插件",
      "settings": "设置"
    },
    "composerHint": "随心输入，让灵感陪你一起写代码吧～",
    "footerNote": "Be Your Light · Dilraba",
    "quickActions": [
      {
        "icon": "</>",
        "title": "探索并理解代码",
        "description": "快速梳理结构与关键模块",
        "prompt": "请帮我探索并理解当前代码库，先概览结构、关键模块和主要流程。"
      },
      {
        "icon": "+",
        "title": "构建新功能、应用或工具",
        "description": "把灵感变成可运行的实现",
        "prompt": "请根据当前项目构建一个新功能，先确认需求并给出可运行的实现。"
      },
      {
        "icon": "✓",
        "title": "审查代码并提出修改建议",
        "description": "定位风险并改善代码质量",
        "prompt": "请审查当前代码，优先查找缺陷、回归风险和缺失测试，并提出修改建议。"
      },
      {
        "icon": "!",
        "title": "修复问题和失败",
        "description": "诊断原因并完成修复验证",
        "prompt": "请诊断当前问题或失败，找到根因、完成修复并验证结果。"
      }
    ]
  },
  "copy": {
    "title": "Codex 热巴星球",
    "replacePlaceholders": {
      "Ask Codex": "Write with inspiration...",
      "Ask Codex anything": "随心输入，让灵感陪你一起写代码吧~",
      "向 Codex 询问任何问题": "随心输入，让灵感陪你一起写代码吧~",
      "给 Codex 发送消息": "随心输入，让灵感陪你一起写代码吧~"
    }
  }
}
